Competitor,Revenue Model,User Base (Est.),Key Features,Strengths,Weaknesses,HustleCodeX Advantage
Codecademy,"Freemium ($19.99/mo Pro), Enterprise B2B","50M+ users, $100M+ Revenue","Interactive coding lessons, career paths, projects","Strong brand, massive content library, recognized certifications","No focus on mental health/recovery, can feel impersonal/corporate","Combines coding education with recovery psychology and community support"
Habitica,"Freemium (Cosmetics, Subscriptions), Group Plans","4M+ users","Gamified task list, RPG elements, parties/guilds","Excellent gamification, strong community aspect, fun pixel art style","No educational content, generic habit tracking, can become repetitive","Specific focus on recovery narrative and real-world skill acquisition (coding)"
I Am Sober,"Freemium (Plus subscription), Community donations","10M+ downloads","Day counter, daily pledges, community forums","Laser-focused on recovery, strong emotional connection, simple UI","No skill building, passive tracking rather than active growth","Transforms 'staying sober' into 'leveling up' with tangible career skills"
freeCodeCamp,"Donation-based (Non-profit)","40M+ monthly visitors","Full stack curriculum, certifications, forum","Completely free, massive community, recognized curriculum","Self-paced can be lonely, no gamification, dry presentation","Gamified narrative layer makes learning addictive in a healthy way"
HustleCodeX,"Freemium ($9.99/mo), Enterprise White-label","Target: 100k in Year 1","Story-driven quests, AI coaching, recovery metrics","Unique niche (Recovery + Tech), emotional hook, dual-value prop","New entrant, smaller content library initially","First-mover in 'Recovery-to-Tech' pipeline, high-impact social mission"
